{
  "profile": "HOT_BASELINE_V1_1",
  "environment": "lab",
  "temp_c": 38,
  "humidity_rh": 45,
  "pressure_kpa": 101.3,
  "season": "summer",
  "weather": "dry",
  "mounting": "MOUNT_V1",
  "drive_profile": "DRIVE_SWEEP_0_150HZ_V1",
  "sensor_pack": "SENS_V1",
  "sample_id": "SAMPLE_V1",
  "thermal": { "ambient_temp_c": 38, "internal_air_temp_c": 38 },
  "water": { "enabled": false, "level_mm": 0 }
}
